<?xml version="1.0" encoding="UTF-8"?>
<!DOCTYPE configuration 
	SYSTEM "namespace.dtd">
	
<configuration>
	<endpoints>
		<endpoint id="testFile" type="file">
			<property name="path">sample/test.rdf</property>			
		</endpoint>
		<endpoint id="testFile2" type="file">
			<property name="path">sample/test2.rdf</property>
		</endpoint>
		<endpoint id="dbpedia" type="url" default="true">
			<property name="url">http://ko.dbpedia.org/sparql</property>
		</endpoint>
	</endpoints>
	
	<namespaces>
		<namespace prefix="hc" url="http://sample.com#"/>
		<namespace prefix="foaf" url="http://xmlns.com/foaf/0.1/"/>
		<namespace prefix="vcard" url="http://www.w3.org/2001/vcard-rdf/3.0#"/>
		<namespace prefix="info" url="http://somewhere/peopleInfo#"/>
	</namespaces>
	
	<mappers>
		<mapper resource="sample/mapper-sample.xml"/>
		<mapper resource="sample/mapper-sample2.xml"/>
	</mappers>
</configuration>